Index,Label,Year,Title,EE,summary
42,acl,2021,TexSmart: A System for Enhanced Natural Language Understanding,https://doi.org/10.18653/v1/2021.acl-demo.1,"Large Language Models (LLMs) have revolutionized natural language processing tasks, demonstrating their exceptional capabilities in various domains. However, their potential for behavior graph understanding in job recommendations remains largely unexplored. This paper focuses on unveiling the capability of large language models in understanding behavior graphs and leveraging this understanding to enhance recommendations in online recruitment, including the promotion of out-of-distribution (OOD) application. We present a novel framework that harnesses the rich contextual information and semantic representations provided by large language models to analyze behavior graphs and uncover underlying patterns and relationships. Specifically, we propose a meta-path prompt constructor that leverages LLM recommender to understand behavior graphs for the first time and design a corresponding path augmentation module to alleviate the prompt bias introduced by path-based sequence input. By leveraging this capability, our framework enables personalized and accurate job recommendations for individual users. We evaluate the effectiveness of our approach on a comprehensive dataset and demonstrate its ability to improve the relevance and quality of recommended quality. This research not only sheds light on the untapped potential of large language models but also provides valuable insights for developing advanced recommendation systems in the recruitment market. The findings contribute to the growing field of natural language processing and offer practical implications for enhancing job search experiences."
43,acl,2021,Personal Bias in Prediction of Emotions Elicited by Textual Opinions,https://doi.org/10.18653/v1/2021.acl-srw.26,"Emotion recognition is predominantly formulated as text classification in which textual units are assigned to an emotion from a predefined inventory (e.g., fear, joy, anger, disgust, sadness, surprise, trust, anticipation). More recently, semantic role labeling approaches have been developed to extract structures from the text to answer questions like: ""who is described to feel the emotion?"" (experiencer), ""what causes this emotion?"" (stimulus), and at which entity is it directed?"" (target). Though it has been shown that jointly modeling stimulus and emotion category prediction is beneficial for both subtasks, it remains unclear which of these semantic roles enables a classifier to infer the emotion. Is it the experiencer, because the identity of a person is biased towards a particular emotion (X is always happy)? Is it a particular target (everybody loves X) or a stimulus (doing X makes everybody sad)? We answer these questions by training emotion classification models on five available datasets annotated with at least one semantic role by masking the fillers of these roles in the text in a controlled manner and find that across multiple corpora, stimuli and targets carry emotion information, while the experiencer might be considered a confounder. Further, we analyze if informing the model about the position of the role improves the classification decision. Particularly on literature corpora we find that the role information improves the emotion classification."
44,acl,2021,A Graphical Interface for Curating Schemas,https://doi.org/10.18653/v1/2021.acl-demo.19,"Event schemas are structured knowledge sources defining typical real-world scenarios (e.g., going to an airport). We present a framework for efficient human-in-the-loop construction of a schema library, based on a novel script induction system and a well-crafted interface that allows non-experts to ""program"" complex event structures. Associated with this work we release a schema library: a machine readable resource of 232 detailed event schemas, each of which describe a distinct typical scenario in terms of its relevant sub-event structure (what happens in the scenario), participants (who plays a role in the scenario), fine-grained typing of each participant, and the implied relational constraints between them. We make our schema library and the SchemaBlocks interface available online."
45,acl,2021,PAWLS: PDF Annotation With Labels and Structure,https://doi.org/10.18653/v1/2021.acl-demo.31,"In this work we propose a pragmatic method that reduces the annotation cost for structured label spaces using active learning. Our approach leverages partial annotation, which reduces labeling costs for structured outputs by selecting only the most informative substructures for annotation. We also utilize selftraining to incorporate the current model's automatic predictions as pseudo-labels for unannotated sub-structures. A key challenge in effectively combining partial annotation with self-training to reduce annotation cost is determining which sub-structures to select to label. To address this challenge we adopt an error estimator to decide the partial selection ratio adaptively according to the current model's capability. In evaluations spanning four structured prediction tasks, we show that our combination of partial annotation and self-training using an adaptive selection ratio reduces annotation cost over strong full annotation baselines under a fair comparison scheme that takes reading time into consideration."
46,acl,2021,Inside ASCENT: Exploring a Deep Commonsense Knowledge Base and its Usage in Question Answering,https://doi.org/10.18653/v1/2021.acl-demo.5,"ASCENT is a fully automated methodology for extracting and consolidating commonsense assertions from web contents (Nguyen et al., WWW 2021). It advances traditional triple-based commonsense knowledge representation by capturing semantic facets like locations and purposes, and composite concepts, i.e., subgroups and related aspects of subjects. In this demo, we present a web portal that allows users to understand its construction process, explore its content, and observe its impact in the use case of question answering. The demo website and an introductory video are both available online."
47,acl,2021,Data Augmentation with Unsupervised Machine Translation Improves the Structural Similarity of Cross-lingual Word Embeddings,https://doi.org/10.18653/v1/2021.acl-srw.17,"Unsupervised cross-lingual word embedding (CLWE) methods learn a linear transformation matrix that maps two monolingual embedding spaces that are separately trained with monolingual corpora. This method relies on the assumption that the two embedding spaces are structurally similar, which does not necessarily hold true in general. In this paper, we argue that using a pseudo-parallel corpus generated by an unsupervised machine translation model facilitates the structural similarity of the two embedding spaces and improves the quality of CLWEs in the unsupervised mapping method. We show that our approach outperforms other alternative approaches given the same amount of data, and, through detailed analysis, we show that data augmentation with the pseudo data from unsupervised machine translation is especially effective for mapping-based CLWEs because (1) the pseudo data makes the source and target corpora (partially) parallel; (2) the pseudo data contains information on the original language that helps to learn similar embedding spaces between the source and target languages."
48,acl,2021,"CLTR: An End-to-End, Transformer-Based System for Cell-Level Table Retrieval and Table Question Answering",https://doi.org/10.18653/v1/2021.acl-demo.24,"We present the first end-to-end, transformer-based table question answering (QA) system that takes natural language questions and massive table corpus as inputs to retrieve the most relevant tables and locate the correct table cells to answer the question. Our system, CLTR, extends the current state-of-the-art QA over tables model to build an end-to-end table QA architecture. This system has successfully tackled many real-world table QA problems with a simple, unified pipeline. Our proposed system can also generate a heatmap of candidate columns and rows over complex tables and allow users to quickly identify the correct cells to answer questions. In addition, we introduce two new open-domain benchmarks, E2E_WTQ and E2E_GNQ, consisting of 2,005 natural language questions over 76,242 tables. The benchmarks are designed to validate CLTR as well as accommodate future table retrieval and end-to-end table QA research and experiments. Our experiments demonstrate that our system is the current state-of-the-art model on the table retrieval task and produces promising results for end-to-end table QA."
49,acl,2021,CMTA: COVID-19 Misinformation Multilingual Analysis on Twitter,https://doi.org/10.18653/v1/2021.acl-srw.28,"Misinformation/disinformation about COVID-19 has been rampant on social media around the world. In this study, we investigate COVID-19 misinformation/ disinformation on social media in multiple languages - Farsi (Persian), Chinese, and English, about multiple countries - Iran, China, and the United States (US), and on multiple platforms such as Twitter, Facebook, Instagram, Weibo, and WhatsApp. Misinformation, especially about a global pandemic, is a global problem yet it is common for studies of COVID-19 misinformation on social media to focus on a single language, like English, a single country, like the US, or a single platform, like Twitter. We utilized opportunistic sampling to compile 200 specific items of viral and yet debunked misinformation across these languages, countries and platforms emerged between January 1 and August 31. We then categorized this collection based both on the topics of the misinformation and the underlying roots of that misinformation. Our multi-cultural and multilingual team observed that the nature of COVID-19 misinformation on social media varied in substantial ways across different languages/countries depending on the cultures, beliefs/religions, popularity of social media, types of platforms, freedom of speech and the power of people versus governments. We observe that politics is at the root of most of the collected misinformation across all three languages in this dataset. We further observe the different impact of government restrictions on platforms and platform restrictions on content in Iran, China, and the US and their impact on a key question of our age: how do we control misinformation without silencing the voices we need to hold governments accountable?"
50,acl,2021,"ProphetNet-X: Large-Scale Pre-training Models for English, Chinese, Multi-lingual, Dialog, and Code Generation",https://doi.org/10.18653/v1/2021.acl-demo.28,"Now, the pre-training technique is ubiquitous in natural language processing field. ProphetNet is a pre-training based natural language generation method which shows powerful performance on English text summarization and question generation tasks. In this paper, we extend ProphetNet into other domains and languages, and present the ProphetNet family pre-training models, named ProphetNet-X, where X can be English, Chinese, Multi-lingual, and so on. We pre-train a cross-lingual generation model ProphetNet-Multi, a Chinese generation model ProphetNet-Zh, two open-domain dialog generation models ProphetNet-Dialog-En and ProphetNet-Dialog-Zh. And also, we provide a PLG (Programming Language Generation) model ProphetNet-Code to show the generation performance besides NLG (Natural Language Generation) tasks. In our experiments, ProphetNet-X models achieve new state-of-the-art performance on 10 benchmarks. All the models of ProphetNet-X share the same model structure, which allows users to easily switch between different models. We make the code and models publicly available, and we will keep updating more pre-training models and finetuning scripts."
51,acl,2021,Neural Extractive Search,https://doi.org/10.18653/v1/2021.acl-demo.25,"Domain experts often need to extract structured information from large corpora. We advocate for a search paradigm called ``extractive search'', in which a search query is enriched with capture-slots, to allow for such rapid extraction. Such an extractive search system can be built around syntactic structures, resulting in high-precision, low-recall results. We show how the recall can be improved using neural retrieval and alignment. The goals of this paper are to concisely introduce the extractive-search paradigm; and to demonstrate a prototype neural retrieval system for extractive search and its benefits and potential. Our prototype is available at \url{https://spike.neural-sim.apps.allenai.org/} and a video demonstration is available at \url{https://vimeo.com/559586687}."
52,acl,2021,MT-Telescope: An interactive platform for contrastive evaluation of MT systems,https://doi.org/10.18653/v1/2021.acl-demo.9,"Automatic machine translation (MT) metrics are widely used to distinguish the translation qualities of machine translation systems across relatively large test sets (system-level evaluation). However, it is unclear if automatic metrics are reliable at distinguishing good translations from bad translations at the sentence level (segment-level evaluation). In this paper, we investigate how useful MT metrics are at detecting the success of a machine translation component when placed in a larger platform with a downstream task. We evaluate the segment-level performance of the most widely used MT metrics (chrF, COMET, BERTScore, etc.) on three downstream cross-lingual tasks (dialogue state tracking, question answering, and semantic parsing). For each task, we only have access to a monolingual task-specific model. We calculate the correlation between the metric's ability to predict a good/bad translation with the success/failure on the final task for the Translate-Test setup. Our experiments demonstrate that all metrics exhibit negligible correlation with the extrinsic evaluation of the downstream outcomes. We also find that the scores provided by neural metrics are not interpretable mostly because of undefined ranges. We synthesise our analysis into recommendations for future MT metrics to produce labels rather than scores for more informative interaction between machine translation and multilingual language understanding."
53,acl,2021,Attending Self-Attention: A Case Study of Visually Grounded Supervision in Vision-and-Language Transformers,https://doi.org/10.18653/v1/2021.acl-srw.8,"Visual dialogue is a challenging task since it needs to answer a series of coherent questions on the basis of understanding the visual environment. Previous studies focus on the implicit exploration of multimodal co-reference by implicitly attending to spatial image features or object-level image features but neglect the importance of locating the objects explicitly in the visual content, which is associated with entities in the textual content. Therefore, in this paper we propose a {\bf M}ultimodal {\bf I}ncremental {\bf T}ransformer with {\bf V}isual {\bf G}rounding, named MITVG, which consists of two key parts: visual grounding and multimodal incremental transformer. Visual grounding aims to explicitly locate related objects in the image guided by textual entities, which helps the model exclude the visual content that does not need attention. On the basis of visual grounding, the multimodal incremental transformer encodes the multi-turn dialogue history combined with visual scene step by step according to the order of the dialogue and then generates a contextually and visually coherent response. Experimental results on the VisDial v0.9 and v1.0 datasets demonstrate the superiority of the proposed model, which achieves comparable performance."
54,acl,2021,TweeNLP: A Twitter Exploration Portal for Natural Language Processing,https://doi.org/10.18653/v1/2021.acl-demo.32,"We present TweeNLP, a one-stop portal that organizes Twitter's natural language processing (NLP) data and builds a visualization and exploration platform. It curates 19,395 tweets (as of April 2021) from various NLP conferences and general NLP discussions. It supports multiple features such as TweetExplorer to explore tweets by topics, visualize insights from Twitter activity throughout the organization cycle of conferences, discover popular research papers and researchers. It also builds a timeline of conference and workshop submission deadlines. We envision TweeNLP to function as a collective memory unit for the NLP community by integrating the tweets pertaining to research papers with the NLPExplorer scientific literature search engine. The current system is hosted at http://nlpexplorer.org/twitter/CFP ."
55,acl,2021,SciConceptMiner: A system for large-scale scientific concept discovery,https://doi.org/10.18653/v1/2021.acl-demo.6,"If scientific discovery is one of the main driving forces of human progress, insight is the fuel for the engine, which has long attracted behavior-level research to understand and model its underlying cognitive process. However, current tasks that abstract scientific discovery mostly focus on the emergence of insight, ignoring the special role played by domain knowledge. In this concept paper, we view scientific discovery as an interplay between $thinking \ out \ of \ the \ box$ that actively seeks insightful solutions and $thinking \ inside \ the \ box$ that generalizes on conceptual domain knowledge to keep correct. Accordingly, we propose Mindle, a semantic searching game that triggers scientific-discovery-like thinking spontaneously, as infrastructure for exploring scientific discovery on a large scale. On this basis, the meta-strategies for insights and the usage of concepts can be investigated reciprocally. In the pilot studies, several interesting observations inspire elaborated hypotheses on meta-strategies, context, and individual diversity for further investigations."
56,acl,2021,Improving the Robustness of QA Models to Challenge Sets with Variational Question-Answer Pair Generation,https://doi.org/10.18653/v1/2021.acl-srw.21,"Question answering (QA) models for reading comprehension have achieved human-level accuracy on in-distribution test sets. However, they have been demonstrated to lack robustness to challenge sets, whose distribution is different from that of training sets. Existing data augmentation methods mitigate this problem by simply augmenting training sets with synthetic examples sampled from the same distribution as the challenge sets. However, these methods assume that the distribution of a challenge set is known a priori, making them less applicable to unseen challenge sets. In this study, we focus on question-answer pair generation (QAG) to mitigate this problem. While most existing QAG methods aim to improve the quality of synthetic examples, we conjecture that diversity-promoting QAG can mitigate the sparsity of training sets and lead to better robustness. We present a variational QAG model that generates multiple diverse QA pairs from a paragraph. Our experiments show that our method can improve the accuracy of 12 challenge sets, as well as the in-distribution accuracy. Our code and data are available at https://github.com/KazutoshiShinoda/VQAG."
57,acl,2021,How Many Layers and Why? An Analysis of the Model Depth in Transformers,https://doi.org/10.18653/v1/2021.acl-srw.23,"This paper presents the deductive formal verification of high-level properties of control systems with theorem proving, using the Why3 tool. Properties that can be verified with this approach include stability, feedback gain, and robustness, among others. For the systems, modelled in Simulink, we propose three main steps to achieve the verification: specifying the properties of interest over the signals within the model using Simulink blocks, an automatic translation of the model into Why3, and the automatic verification of the properties with theorem provers in Why3. We present a methodology to specify the properties in the model and a library of relevant assertion blocks (logic expressions), currently in development. The functionality of the blocks in the Simulink models are automatically translated to Why3 as theories and verification goals by our tool implemented in MATLAB. A library of theories in Why3 corresponding to each supported block has been developed to facilitate the process of translation. The goals are automatically verified in Why3 with relevant theorem provers. A simple first-order discrete system is used to exemplify the specification of the Simulink model, the translation process from Simulink to the Why3 formal logic language, and the verification of Lyapunov stability."
58,acl,2021,"&quot;Hold on honey, men at work&quot;: A semi-supervised approach to detecting sexism in sitcoms",https://doi.org/10.18653/v1/2021.acl-srw.19,"Research has focused on automated methods to effectively detect sexism online. Although overt sexism seems easy to spot, its subtle forms and manifold expressions are not. In this paper, we outline the different dimensions of sexism by grounding them in their implementation in psychological scales. From the scales, we derive a codebook for sexism in social media, which we use to annotate existing and novel datasets, surfacing their limitations in breadth and validity with respect to the construct of sexism. Next, we leverage the annotated datasets to generate adversarial examples, and test the reliability of sexism detection methods. Results indicate that current machine learning models pick up on a very narrow set of linguistic markers of sexism and do not generalize well to out-of-domain examples. Yet, including diverse data and adversarial examples at training time results in models that generalize better and that are more robust to artifacts of data collection. By providing a scale-based codebook and insights regarding the shortcomings of the state-of-the-art, we hope to contribute to the development of better and broader models for sexism detection, including reflections on theory-driven approaches to data collection."
59,acl,2021,"Situation-Based Multiparticipant Chat Summarization: a Concept, an Exploration-Annotation Tool and an Example Collection",https://doi.org/10.18653/v1/2021.acl-srw.14,"In a distance learning context, providing usual communication tools (forum, chat, ...) is not always enough to create efficient interactions between learners and to favour collective knowledge building. A solution consists in setting-up collective activities which encourage learners to communicate. But, even in that case, tools can sometimes become a barrier to communication. We present in this paper examples of specific tools that are designed in order to favour and to guide communications in an educational context, but also to foster interactions during learning activities that are not inherently collaborative. We describe synchronous communication tools (semi-structured chat), asynchronous tools (temporally structured forum, contextual forum) and a system which promotes mutual aid between learners."
60,acl,2021,Observing the Learning Curve of NMT Systems With Regard to Linguistic Phenomena,https://doi.org/10.18653/v1/2021.acl-srw.20,"Document-level context for neural machine translation (NMT) is crucial to improve the translation consistency and cohesion, the translation of ambiguous inputs, as well as several other linguistic phenomena. Many works have been published on the topic of document-level NMT, but most restrict the system to only local context, typically including just the one or two preceding sentences as additional information. This might be enough to resolve some ambiguous inputs, but it is probably not sufficient to capture some document-level information like the topic or style of a conversation. When increasing the context size beyond just the local context, there are two challenges: (i) the~memory usage increases exponentially (ii) the translation performance starts to degrade. We argue that the widely-used attention mechanism is responsible for both issues. Therefore, we propose a constrained attention variant that focuses the attention on the most relevant parts of the sequence, while simultaneously reducing the memory consumption. For evaluation, we utilize targeted test sets in combination with novel evaluation techniques to analyze the translations in regards to specific discourse-related phenomena. We find that our approach is a good compromise between sentence-level NMT vs attending to the full context, especially in low resource scenarios."
61,acl,2021,&quot;I&apos;ve Seen Things You People Wouldn&apos;t Believe&quot;: Hallucinating Entities in GuessWhat?!,https://doi.org/10.18653/v1/2021.acl-srw.11,No results found
62,acl,2021,Investigation on Data Adaptation Techniques for Neural Named Entity Recognition,https://doi.org/10.18653/v1/2021.acl-srw.1,"Data processing is an important step in various natural language processing tasks. As the commonly used datasets in named entity recognition contain only a limited number of samples, it is important to obtain additional labeled data in an efficient and reliable manner. A common practice is to utilize large monolingual unlabeled corpora. Another popular technique is to create synthetic data from the original labeled data (data augmentation). In this work, we investigate the impact of these two methods on the performance of three different named entity recognition tasks."
