Index,Label,Year,Title,EE,summary
22,acl,2021,Neural Machine Translation with Synchronous Latent Phrase Structure,https://doi.org/10.18653/v1/2021.acl-srw.33,"Phrases play an important role in natural language understanding and machine translation (Sag et al., 2002; Villavicencio et al., 2005). However, it is difficult to integrate them into current neural machine translation (NMT) which reads and generates sentences word by word. In this work, we propose a method to translate phrases in NMT by integrating a phrase memory storing target phrases from a phrase-based statistical machine translation (SMT) system into the encoder-decoder architecture of NMT. At each decoding step, the phrase memory is first re-written by the SMT model, which dynamically generates relevant target phrases with contextual information provided by the NMT model. Then the proposed model reads the phrase memory to make probability estimations for all phrases in the phrase memory. If phrase generation is carried on, the NMT decoder selects an appropriate phrase from the memory to perform phrase translation and updates its decoding state by consuming the words in the selected phrase. Otherwise, the NMT decoder generates a word from the vocabulary as the general NMT decoder does. Experiment results on the Chinese to English translation show that the proposed model achieves significant improvements over the baseline on various test sets."
23,acl,2021,ESRA: Explainable Scientific Research Assistant,https://doi.org/10.18653/v1/2021.acl-demo.14,"With the advent of the information age, the scale of data on the Internet is getting larger and larger, and it is full of text, images, videos, and other information. Different from social media data and news data, scientific research achievements information has the characteristics of many proper nouns and strong ambiguity. The traditional single-mode query method based on keywords can no longer meet the needs of scientific researchers and managers of the Ministry of Science and Technology. Scientific research project information and scientific research scholar information contain a large amount of valuable scientific research achievement information. Evaluating the output capability of scientific research projects and scientific research teams can effectively assist managers in decision-making. In view of the above background, this paper expounds on the research status from four aspects: characteristic learning of scientific research results, cross-media research results query, ranking learning of scientific research results, and cross-media scientific research achievement query system."
24,acl,2021,Exploring Word Usage Change with Continuously Evolving Embeddings,https://doi.org/10.18653/v1/2021.acl-demo.35,"We propose using automatically generated natural language definitions of contextualised word usages as interpretable word and word sense representations. Given a collection of usage examples for a target word, and the corresponding data-driven usage clusters (i.e., word senses), a definition is generated for each usage with a specialised Flan-T5 language model, and the most prototypical definition in a usage cluster is chosen as the sense label.   We demonstrate how the resulting sense labels can make existing approaches to semantic change analysis more interpretable, and how they can allow users -- historical linguists, lexicographers, or social scientists -- to explore and intuitively explain diachronic trajectories of word meaning. Semantic change analysis is only one of many possible applications of the `definitions as representations' paradigm. Beyond being human-readable, contextualised definitions also outperform token or usage sentence embeddings in word-in-context semantic similarity judgements, making them a new promising type of lexical representation for NLP."
25,acl,2021,Stretch-VST: Getting Flexible With Visual Stories,https://doi.org/10.18653/v1/2021.acl-demo.42,"A storyboard is a sequence of images to illustrate a story containing multiple sentences, which has been a key process to create different story products. In this paper, we tackle a new multimedia task of automatic storyboard creation to facilitate this process and inspire human artists. Inspired by the fact that our understanding of languages is based on our past experience, we propose a novel inspire-and-create framework with a story-to-image retriever that selects relevant cinematic images for inspiration and a storyboard creator that further refines and renders images to improve the relevancy and visual consistency. The proposed retriever dynamically employs contextual information in the story with hierarchical attentions and applies dense visual-semantic matching to accurately retrieve and ground images. The creator then employs three rendering steps to increase the flexibility of retrieved images, which include erasing irrelevant regions, unifying styles of images and substituting consistent characters. We carry out extensive experiments on both in-domain and out-of-domain visual story datasets. The proposed model achieves better quantitative performance than the state-of-the-art baselines for storyboard creation. Qualitative visualizations and user studies further verify that our approach can create high-quality storyboards even for stories in the wild."
26,acl,2021,ParCourE: A Parallel Corpus Explorer for a Massively Multilingual Corpus,https://doi.org/10.18653/v1/2021.acl-demo.8,"With more than 7000 languages worldwide, multilingual natural language processing (NLP) is essential both from an academic and commercial perspective. Researching typological properties of languages is fundamental for progress in multilingual NLP. Examples include assessing language similarity for effective transfer learning, injecting inductive biases into machine learning models or creating resources such as dictionaries and inflection tables. We provide ParCourE, an online tool that allows to browse a word-aligned parallel corpus, covering 1334 languages. We give evidence that this is useful for typological research. ParCourE can be set up for any parallel corpus and can thus be used for typological research on other corpora as well as for exploring their quality and properties."
27,acl,2021,Modeling Text using the Continuous Space Topic Model with Pre-Trained Word Embeddings,https://doi.org/10.18653/v1/2021.acl-srw.15,"Though word embeddings and topics are complementary representations, several past works have only used pretrained word embeddings in (neural) topic modeling to address data sparsity in short-text or small collection of documents. This work presents a novel neural topic modeling framework using multi-view embedding spaces: (1) pretrained topic-embeddings, and (2) pretrained word-embeddings (context insensitive from Glove and context-sensitive from BERT models) jointly from one or many sources to improve topic quality and better deal with polysemy. In doing so, we first build respective pools of pretrained topic (i.e., TopicPool) and word embeddings (i.e., WordPool). We then identify one or more relevant source domain(s) and transfer knowledge to guide meaningful learning in the sparse target domain. Within neural topic modeling, we quantify the quality of topics and document representations via generalization (perplexity), interpretability (topic coherence) and information retrieval (IR) using short-text, long-text, small and large document collections from news and medical domains. Introducing the multi-source multi-view embedding spaces, we have shown state-of-the-art neural topic modeling using 6 source (high-resource) and 5 target (low-resource) corpora."
28,acl,2021,Zero Pronouns Identification based on Span prediction,https://doi.org/10.18653/v1/2021.acl-srw.34,"Pronouns are important determinants of a text's meaning but difficult to translate. This is because pronoun choice can depend on entities described in previous sentences, and in some languages pronouns may be dropped when the referent is inferrable from the context. These issues can lead Neural Machine Translation (NMT) systems to make critical errors on pronouns that impair intelligibility and even reinforce gender bias. We investigate the severity of this pronoun issue, showing that (1) in some domains, pronoun choice can account for more than half of a NMT systems' errors, and (2) pronouns have a disproportionately large impact on perceived translation quality. We then investigate a possible solution: fine-tuning BERT on a pronoun prediction task using chunks of source-side sentences, then using the resulting classifier to repair the translations of an existing NMT model. We offer an initial case study of this approach for the Japanese-English language pair, observing that a small number of translations are significantly improved according to human evaluators."
29,acl,2021,CogIE: An Information Extraction Toolkit for Bridging Texts and CogNet,https://doi.org/10.18653/v1/2021.acl-demo.11,"OpenNRE is an open-source and extensible toolkit that provides a unified framework to implement neural models for relation extraction (RE). Specifically, by implementing typical RE methods, OpenNRE not only allows developers to train custom models to extract structured relational facts from the plain text but also supports quick model validation for researchers. Besides, OpenNRE provides various functional RE modules based on both TensorFlow and PyTorch to maintain sufficient modularity and extensibility, making it becomes easy to incorporate new models into the framework. Besides the toolkit, we also release an online system to meet real-time extraction without any training and deploying. Meanwhile, the online system can extract facts in various scenarios as well as aligning the extracted facts to Wikidata, which may benefit various downstream knowledge-driven applications (e.g., information retrieval and question answering). More details of the toolkit and online system can be obtained from http://github.com/thunlp/OpenNRE."
30,acl,2021,The Classical Language Toolkit: An NLP Framework for Pre-Modern Languages,https://doi.org/10.18653/v1/2021.acl-demo.3,"This study provides an overview of the history of the development of Natural Language Processing (NLP) in the context of the Indonesian language, with a focus on the basic technologies, methods, and practical applications that have been developed. This review covers developments in basic NLP technologies such as stemming, part-of-speech tagging, and related methods; practical applications in cross-language information retrieval systems, information extraction, and sentiment analysis; and methods and techniques used in Indonesian language NLP research, such as machine learning, statistics-based machine translation, and conflict-based approaches. This study also explores the application of NLP in Indonesian language industry and research and identifies challenges and opportunities in Indonesian language NLP research and development. Recommendations for future Indonesian language NLP research and development include developing more efficient methods and technologies, expanding NLP applications, increasing sustainability, further research into the potential of NLP, and promoting interdisciplinary collaboration. It is hoped that this review will help researchers, practitioners, and the government to understand the development of Indonesian language NLP and identify opportunities for further research and development."
31,acl,2021,Proceedings of the ACL-IJCNLP 2021 Student Research Workshop,https://aclanthology.org/2021.acl-srw.0,"Mentorship in the AI community is crucial to maintaining and increasing diversity, especially with respect to fostering the academic growth of underserved students. While the research process itself is important, there is not sufficient emphasis on the submission, presentation, and publication process, which is a cause for concern given the meteoric rise of predatory scientific conferences, which are based on profit only and have little to no peer review. These conferences are a direct threat to integrity in science by promoting work with little to no scientific merit. However, they also threaten diversity in the AI community by marginalizing underrepresented groups away from legitimate conferences due to convenience and targeting mechanisms like e-mail invitations. Due to the importance of conference presentation in AI research, this very specific problem must be addressed through direct mentorship. In this work, we propose PreDefense, a mentorship program that seeks to guide underrepresented students through the scientific conference and workshop process, with an emphasis on choosing legitimate venues that align with the specific work that the students are focused in and preparing students of all backgrounds for future successful, integrous AI research careers."
32,acl,2021,Edit Distance Based Curriculum Learning for Paraphrase Generation,https://doi.org/10.18653/v1/2021.acl-srw.24,"Curriculum Data Augmentation (CDA) improves neural models by presenting synthetic data with increasing difficulties from easy to hard. However, traditional CDA simply treats the ratio of word perturbation as the difficulty measure and goes through the curriculums only once. This paper presents \textbf{PCC}: \textbf{P}araphrasing with Bottom-k Sampling and \textbf{C}yclic Learning for \textbf{C}urriculum Data Augmentation, a novel CDA framework via paraphrasing, which exploits the textual paraphrase similarity as the curriculum difficulty measure. We propose a curriculum-aware paraphrase generation module composed of three units: a paraphrase candidate generator with bottom-k sampling, a filtering mechanism and a difficulty measure. We also propose a cyclic learning strategy that passes through the curriculums multiple times. The bottom-k sampling is proposed to generate super-hard instances for the later curriculums. Experimental results on few-shot text classification as well as dialogue generation indicate that PCC surpasses competitive baselines. Human evaluation and extensive case studies indicate that bottom-k sampling effectively generates super-hard instances, and PCC significantly improves the baseline dialogue agent."
33,acl,2021,LOA: Logical Optimal Actions for Text-based Interaction Games,https://doi.org/10.18653/v1/2021.acl-demo.27,"A player plays a game by sending messages into the game world using an interaction technique. These messages are then translated into actions performed on or by game objects towards achieving the game's objectives. A game's interaction model is the bridge between the player's interaction and its in-game actions by defining what the player may and may not act upon at any given moment. This makes the choice of interaction technique, its associated actions, and interaction model critical for designing games that are engaging, immersive, and intuitive to play. This paper presents a study focused on One-Touch-Gesture mobile games, with the aim of identifying the touch gestures used in popular games of this type, the types of in-game actions associated with these gestures, and the interaction models used by these games. The study was conducted by reviewing 77 of the most popular games in the last two years through playtesting by two researchers. The results of the study contribute to existing knowledge by providing an insight into the interactions and actions of popular 1TG games and providing a guide to aid in developing games of the type."
34,acl,2021,Joint Detection and Coreference Resolution of Entities and Events with Document-level Context Aggregation,https://doi.org/10.18653/v1/2021.acl-srw.18,"Recognizing coreferring events and entities across multiple texts is crucial for many NLP applications. Despite the task's importance, research focus was given mostly to within-document entity coreference, with rather little attention to the other variants. We propose a neural architecture for cross-document coreference resolution. Inspired by Lee et al (2012), we jointly model entity and event coreference. We represent an event (entity) mention using its lexical span, surrounding context, and relation to entity (event) mentions via predicate-arguments structures. Our model outperforms the previous state-of-the-art event coreference model on ECB+, while providing the first entity coreference results on this corpus. Our analysis confirms that all our representation elements, including the mention span itself, its context, and the relation to other mentions contribute to the model's success."
35,acl,2021,How do different factors Impact the Inter-language Similarity? A Case Study on Indian languages,https://doi.org/10.18653/v1/2021.acl-srw.12,"In this paper we present our work on a case study between Statistical Machien Transaltion (SMT) and Rule-Based Machine Translation (RBMT) systems on English-Indian langugae and Indian to Indian langugae perspective. Main objective of our study is to make a five way performance compariosn; such as, a) SMT and RBMT b) SMT on English-Indian langugae c) RBMT on English-Indian langugae d) SMT on Indian to Indian langugae perspective e) RBMT on Indian to Indian langugae perspective. Through a detailed analysis we describe the Rule Based and the Statistical Machine Translation system developments and its evaluations. Through a detailed error analysis, we point out the relative strengths and weaknesses of both systems. The observations based on our study are: a) SMT systems outperforms RBMT b) In the case of SMT, English to Indian language MT systmes performs better than Indian to English langugae MT systems c) In the case of RBMT, English to Indian langugae MT systems perofrms better than Indian to Englsih Language MT systems d) SMT systems performs better for Indian to Indian language MT systems compared to RBMT. Effectively, we shall see that even with a small amount of training corpus a statistical machine translation system has many advantages for high quality domain specific machine translation over that of a rule-based counterpart."
36,acl,2021,IntelliCAT: Intelligent Machine Translation Post-Editing with Quality Estimation and Translation Suggestion,https://doi.org/10.18653/v1/2021.acl-demo.2,"Semi-supervised learning that leverages synthetic training data has been widely adopted in the field of Automatic post-editing (APE) to overcome the lack of human-annotated training data. In that context, data-synthesis methods to create high-quality synthetic data have also received much attention. Considering that APE takes machine-translation outputs containing translation errors as input, we propose a noising-based data-synthesis method that uses a mask language model to create noisy texts through substituting masked tokens with erroneous tokens, yet following the error-quantity statistics appearing in genuine APE data. In addition, we propose corpus interleaving, which is to combine two separate synthetic data by taking only advantageous samples, to further enhance the quality of the synthetic data created with our noising method. Experimental results reveal that using the synthetic data created with our approach results in significant improvements in APE performance upon using other synthetic data created with different existing data-synthesis methods."
37,acl,2021,Supporting Complaints Investigation for Nursing and Midwifery Regulatory Agencies,https://doi.org/10.18653/v1/2021.acl-demo.10,"A text mining approach is proposed based on latent Dirichlet allocation (LDA) to analyze the Consumer Financial Protection Bureau (CFPB) consumer complaints. The proposed approach aims to extract latent topics in the CFPB complaint narratives, and explores their associated trends over time. The time trends will then be used to evaluate the effectiveness of the CFPB regulations and expectations on financial institutions in creating a consumer oriented culture that treats consumers fairly and prioritizes consumer protection in their decision making processes. The proposed approach can be easily operationalized as a decision support system to automate detection of emerging topics in consumer complaints. Hence, the technology-human partnership between the proposed approach and the CFPB team could certainly improve consumer protections from unfair, deceptive or abusive practices in the financial markets by providing more efficient and effective investigations of consumer complaint narratives."
38,acl,2021,LEGOEval: An Open-Source Toolkit for Dialogue System Evaluation via Crowdsourcing,https://doi.org/10.18653/v1/2021.acl-demo.38,"We present LEGOEval, an open-source toolkit that enables researchers to easily evaluate dialogue systems in a few lines of code using the online crowdsource platform, Amazon Mechanical Turk. Compared to existing toolkits, LEGOEval features a flexible task design by providing a Python API that maps to commonly used React.js interface components. Researchers can personalize their evaluation procedures easily with our built-in pages as if playing with LEGO blocks. Thus, LEGOEval provides a fast, consistent method for reproducing human evaluation results. Besides the flexible task design, LEGOEval also offers an easy API to review collected data."
39,acl,2021,"TextBox: A Unified, Modularized, and Extensible Framework for Text Generation",https://doi.org/10.18653/v1/2021.acl-demo.4,"In this paper, we release an open-source library, called TextBox, to provide a unified, modularized, and extensible text generation framework. TextBox aims to support a broad set of text generation tasks and models. In our library, we implement 21 text generation models on 9 benchmark datasets, covering the categories of VAE, GAN, and pretrained language models. Meanwhile, our library maintains sufficient modularity and extensibility by properly decomposing the model architecture, inference, and learning process into highly reusable modules, which allows users to easily incorporate new models into our framework. The above features make TextBox specially suitable for researchers and practitioners to quickly reproduce baseline models and develop new models. TextBox is implemented based on PyTorch, and released under Apache License 2.0 at https://github.com/RUCAIBox/TextBox."
40,acl,2021,skweak: Weak Supervision Made Easy for NLP,https://doi.org/10.18653/v1/2021.acl-demo.40,"We present skweak, a versatile, Python-based software toolkit enabling NLP developers to apply weak supervision to a wide range of NLP tasks. Weak supervision is an emerging machine learning paradigm based on a simple idea: instead of labelling data points by hand, we use labelling functions derived from domain knowledge to automatically obtain annotations for a given dataset. The resulting labels are then aggregated with a generative model that estimates the accuracy (and possible confusions) of each labelling function. The skweak toolkit makes it easy to implement a large spectrum of labelling functions (such as heuristics, gazetteers, neural models or linguistic constraints) on text data, apply them on a corpus, and aggregate their results in a fully unsupervised fashion. skweak is especially designed to facilitate the use of weak supervision for NLP tasks such as text classification and sequence labelling. We illustrate the use of skweak for NER and sentiment analysis. skweak is released under an open-source license and is available at: https://github.com/NorskRegnesentral/skweak"
41,acl,2021,ExplainaBoard: An Explainable Leaderboard for NLP,https://doi.org/10.18653/v1/2021.acl-demo.34,"Leaderboard systems allow researchers to objectively evaluate Natural Language Processing (NLP) models and are typically used to identify models that exhibit superior performance on a given task in a predetermined setting. However, we argue that evaluation on a given test dataset is just one of many performance indications of the model. In this paper, we claim leaderboard competitions should also aim to identify models that exhibit the best performance in a real-world setting. We highlight three issues with current leaderboard systems: (1) the use of a single, static test set, (2) discrepancy between testing and real-world application (3) the tendency for leaderboard-centric competition to be biased towards the test set. As a solution, we propose a new paradigm of leaderboard systems that addresses these issues of current leaderboard system. Through this study, we hope to induce a paradigm shift towards more real -world-centric leaderboard competitions."
