Index,Label,Year,Title,EE,summary
1,acl,2021,A Case Study of Analysis of Construals in Language on Social Media Surrounding a Crisis Event,https://doi.org/10.18653/v1/2021.acl-srw.31,"Social media data has emerged as a useful source of timely information about real-world crisis events. One of the main tasks related to the use of social media for disaster management is the automatic identification of crisis-related messages. Most of the studies on this topic have focused on the analysis of data for a particular type of event in a specific language. This limits the possibility of generalizing existing approaches because models cannot be directly applied to new types of events or other languages. In this work, we study the task of automatically classifying messages that are related to crisis events by leveraging cross-language and cross-domain labeled data. Our goal is to make use of labeled data from high-resource languages to classify messages from other (low-resource) languages and/or of new (previously unseen) types of crisis situations. For our study we consolidated from the literature a large unified dataset containing multiple crisis events and languages. Our empirical findings show that it is indeed possible to leverage data from crisis events in English to classify the same type of event in other languages, such as Spanish and Italian (80.0% F1-score). Furthermore, we achieve good performance for the cross-domain task (80.0% F1-score) in a cross-lingual setting. Overall, our work contributes to improving the data scarcity problem that is so important for multilingual crisis classification. In particular, mitigating cold-start situations in emergency events, when time is of essence."
2,acl,2021,Ecco: An Open Source Library for the Explainability of Transformer Language Models,https://doi.org/10.18653/v1/2021.acl-demo.30,"Code intelligence plays a key role in transforming modern software engineering. Recently, deep learning-based models, especially Transformer-based large language models (LLMs), have demonstrated remarkable potential in tackling these tasks by leveraging massive open-source code data and programming language features. However, the development and deployment of such models often require expertise in both machine learning and software engineering, creating a barrier for the model adoption. In this paper, we present CodeTF, an open-source Transformer-based library for state-of-the-art Code LLMs and code intelligence. Following the principles of modular design and extensible framework, we design CodeTF with a unified interface to enable rapid access and development across different types of models, datasets and tasks. Our library supports a collection of pretrained Code LLM models and popular code benchmarks, including a standardized interface to train and serve code LLMs efficiently, and data features such as language-specific parsers and utility functions for extracting code attributes. In this paper, we describe the design principles, the architecture, key modules and components, and compare with other related library tools. Finally, we hope CodeTF is able to bridge the gap between machine learning/generative AI and software engineering, providing a comprehensive open-source solution for developers, researchers, and practitioners."
3,acl,2021,REM: Efficient Semi-Automated Real-Time Moderation of Online Forums,https://doi.org/10.18653/v1/2021.acl-demo.17,"Mental health forums are online communities where people express their issues and seek help from moderators and other users. In such forums, there are often posts with severe content indicating that the user is in acute distress and there is a risk of attempted self-harm. Moderators need to respond to these severe posts in a timely manner to prevent potential self-harm. However, the large volume of daily posted content makes it difficult for the moderators to locate and respond to these critical posts. We present a framework for triaging user content into four severity categories which are defined based on indications of self-harm ideation. Our models are based on a feature-rich classification framework which includes lexical, psycholinguistic, contextual and topic modeling features. Our approaches improve the state of the art in triaging the content severity in mental health forums by large margins (up to 17% improvement over the F-1 scores). Using the proposed model, we analyze the mental state of users and we show that overall, long-term users of the forum demonstrate a decreased severity of risk over time. Our analysis on the interaction of the moderators with the users further indicates that without an automatic way to identify critical content, it is indeed challenging for the moderators to provide timely response to the users in need."
4,acl,2021,COVID-19 and Misinformation: A Large-Scale Lexical Analysis on Twitter,https://doi.org/10.18653/v1/2021.acl-srw.13,"Microbloging is an extremely prevalent broadcast medium amidst the Internet fraternity these days. People share their opinions and sentiments about variety of subjects like products, news, institutions, etc., every day on microbloging websites. Sentiment analysis plays a key role in prediction systems, opinion mining systems, etc. Twitter, one of the microbloging platforms allows a limit of 140 characters to its users. This restriction stimulates users to be very concise about their opinion and twitter an ocean of sentiments to analyze. Twitter also provides developer friendly streaming API for data retrieval purpose allowing the analyst to search real time tweets from various users. In this paper, we discuss the state-of-art of the works which are focused on Twitter, the online social network platform, for sentiment analysis. We survey various lexical, machine learning and hybrid approaches for sentiment analysis on Twitter."
5,acl,2021,Semantics of the Unwritten: The Effect of End of Paragraph and Sequence Tokens on Text Generation with GPT2,https://doi.org/10.18653/v1/2021.acl-srw.16,"The semantics of a text is manifested not only by what is read, but also by what is not read. In this article, we will study how the implicit ""not read"" information such as end-of-paragraph (\eop) and end-of-sequence (\eos) affect the quality of text generation. Specifically, we find that the pre-trained language model GPT2 can generate better continuations by learning to generate the \eop in the fine-tuning stage. Experimental results on English story generation show that \eop can lead to higher BLEU score and lower \eos perplexity. We also conduct experiments on a self-collected Chinese essay dataset with Chinese-GPT2, a character level LM without \eop or \eos during pre-training. Experimental results show that the Chinese GPT2 can generate better essay endings with \eop."
6,acl,2021,Long Document Summarization in a Low Resource Setting using Pretrained Language Models,https://doi.org/10.18653/v1/2021.acl-srw.7,"Abstractive summarization is the task of compressing a long document into a coherent short document while retaining salient information. Modern abstractive summarization methods are based on deep neural networks which often require large training datasets. Since collecting summarization datasets is an expensive and time-consuming task, practical industrial settings are usually low-resource. In this paper, we study a challenging low-resource setting of summarizing long legal briefs with an average source document length of 4268 words and only 120 available (document, summary) pairs. To account for data scarcity, we used a modern pretrained abstractive summarizer BART (Lewis et al., 2020), which only achieves 17.9 ROUGE-L as it struggles with long documents. We thus attempt to compress these long documents by identifying salient sentences in the source which best ground the summary, using a novel algorithm based on GPT-2 (Radford et al., 2019) language model perplexity scores, that operates within the low resource regime. On feeding the compressed documents to BART, we observe a 6.0 ROUGE-L improvement. Our method also beats several competitive salience detection baselines. Furthermore, the identified salient sentences tend to agree with an independent human labeling by domain experts."
7,acl,2021,How Low is Too Low? A Computational Perspective on Extremely Low-Resource Languages,https://doi.org/10.18653/v1/2021.acl-srw.5,"We present LOWA, a novel method for localizing objects with attributes effectively in the wild. It aims to address the insufficiency of current open-vocabulary object detectors, which are limited by the lack of instance-level attribute classification and rare class names. To train LOWA, we propose a hybrid vision-language training strategy to learn object detection and recognition with class names as well as attribute information. With LOWA, users can not only detect objects with class names, but also able to localize objects by attributes. LOWA is built on top of a two-tower vision-language architecture and consists of a standard vision transformer as the image encoder and a similar transformer as the text encoder. To learn the alignment between visual and text inputs at the instance level, we train LOWA with three training steps: object-level training, attribute-aware learning, and free-text joint training of objects and attributes. This hybrid training strategy first ensures correct object detection, then incorporates instance-level attribute information, and finally balances the object class and attribute sensitivity. We evaluate our model performance of attribute classification and attribute localization on the Open-Vocabulary Attribute Detection (OVAD) benchmark and the Visual Attributes in the Wild (VAW) dataset, and experiments indicate strong zero-shot performance. Ablation studies additionally demonstrate the effectiveness of each training step of our approach."
8,acl,2021,Trafilatura: A Web Scraping Library and Command-Line Tool for Text Discovery and Extraction,https://doi.org/10.18653/v1/2021.acl-demo.15,"Search engines are a combination of hardware and computer software supplied by a particular company through the website which has been determined. Search engines collect information from the web through bots or web crawlers that crawls the web periodically. The process of retrieval of information from existing websites is called ""web scraping."" Web scraping is a technique of extracting information from websites. Web scraping is closely related to Web indexing, as for how to develop a web scraping technique that is by first studying the program makers HTML document from the website will be taken to the information in the HTML tag flanking the aim is for information collected after the program makers learn navigation techniques on the website information will be taken to a web application mimicked the scraping that we will create. It should also be noted that the implementation of this writing only scraping involves a free search engine such as: portal garuda, Indonesian scientific journal databases (ISJD), google scholar."
9,acl,2021,Tools Impact on the Quality of Annotations for Chat Untangling,https://doi.org/10.18653/v1/2021.acl-srw.22,"Automatic chat summarization can help people quickly grasp important information from numerous chat messages. Unlike conventional documents, chat logs usually have fragmented and evolving topics. In addition, these logs contain a quantity of elliptical and interrogative sentences, which make the chat summarization highly context dependent. In this work, we propose a novel unsupervised framework called RankAE to perform chat summarization without employing manually labeled data. RankAE consists of a topic-oriented ranking strategy that selects topic utterances according to centrality and diversity simultaneously, as well as a denoising auto-encoder that is carefully designed to generate succinct but context-informative summaries based on the selected utterances. To evaluate the proposed method, we collect a large-scale dataset of chat logs from a customer service environment and build an annotated set only for model evaluation. Experimental results show that RankAE significantly outperforms other unsupervised methods and is able to generate high-quality summaries in terms of relevance and topic coverage."
10,acl,2021,ReTraCk: A Flexible and Efficient Framework for Knowledge Base Question Answering,https://doi.org/10.18653/v1/2021.acl-demo.39,"In this paper, we propose a novel Knowledge-based Embodied Question Answering (K-EQA) task, in which the agent intelligently explores the environment to answer various questions with the knowledge. Different from explicitly specifying the target object in the question as existing EQA work, the agent can resort to external knowledge to understand more complicated question such as ""Please tell me what are objects used to cut food in the room?"", in which the agent must know the knowledge such as ""knife is used for cutting food"".   To address this K-EQA problem, a novel framework based on neural program synthesis reasoning is proposed, where the joint reasoning of the external knowledge and 3D scene graph is performed to realize navigation and question answering. Especially, the 3D scene graph can provide the memory to store the visual information of visited scenes, which significantly improves the efficiency for the multi-turn question answering. Experimental results have demonstrated that the proposed framework is capable of answering more complicated and realistic questions in the embodied environment. The proposed method is also applicable to multi-agent scenarios."
11,acl,2021,Stylistic approaches to predicting Reddit popularity in diglossia,https://doi.org/10.18653/v1/2021.acl-srw.10,"This paper presents a novel approach for modeling threaded discussions on social media using a graph-structured bidirectional LSTM which represents both hierarchical and temporal conversation structure. In experiments with a task of predicting popularity of comments in Reddit discussions, the proposed model outperforms a node-independent architecture for different sets of input features. Analyses show a benefit to the model over the full course of the discussion, improving detection in both early and late stages. Further, the use of language cues with the bidirectional tree state updates helps with identifying controversial comments."
12,acl,2021,Synchronous Syntactic Attention for Transformer Neural Machine Translation,https://doi.org/10.18653/v1/2021.acl-srw.36,"Most neural machine translation models only rely on pairs of parallel sentences, assuming syntactic information is automatically learned by an attention mechanism. In this work, we investigate different approaches to incorporate syntactic knowledge in the Transformer model and also propose a novel, parameter-free, dependency-aware self-attention mechanism that improves its translation quality, especially for long sentences and in low-resource scenarios. We show the efficacy of each approach on WMT English-German and English-Turkish, and WAT English-Japanese translation tasks."
13,acl,2021,Cross-lingual Evidence Improves Monolingual Fake News Detection,https://doi.org/10.18653/v1/2021.acl-srw.32,"Misleading information spreads on the Internet at an incredible speed, which can lead to irreparable consequences in some cases. It is becoming essential to develop fake news detection technologies. While substantial work has been done in this direction, one of the limitations of the current approaches is that these models are focused only on one language and do not use multilingual information. In this work, we propose Multiverse -- a new feature based on multilingual evidence that can be used for fake news detection and improve existing approaches. The hypothesis of the usage of cross-lingual evidence as a feature for fake news detection is confirmed, firstly, by manual experiment based on a set of known true and fake news. After that, we compared our fake news classification system based on the proposed feature with several baselines on two multi-domain datasets of general-topic news and one fake COVID-19 news dataset showing that in additional combination with linguistic features it yields significant improvements."
14,acl,2021,Does My Representation Capture X? Probe-Ably,https://doi.org/10.18653/v1/2021.acl-demo.23,"Probing (or diagnostic classification) has become a popular strategy for investigating whether a given set of intermediate features is present in the representations of neural models. Probing studies may have misleading results, but various recent works have suggested more reliable methodologies that compensate for the possible pitfalls of probing. However, these best practices are numerous and fast-evolving. To simplify the process of running a set of probing experiments in line with suggested methodologies, we introduce Probe-Ably: an extendable probing framework which supports and automates the application of probing methods to the user's inputs."
15,acl,2021,Changing the Basis of Contextual Representations with Explicit Semantics,https://doi.org/10.18653/v1/2021.acl-srw.25,"We present a qualitative analysis of the (potentially erroneous) outputs of contextualized embedding-based methods for detecting diachronic semantic change. First, we introduce an ensemble method outperforming previously described contextualized approaches. This method is used as a basis for an in-depth analysis of the degrees of semantic change predicted for English words across 5 decades. Our findings show that contextualized methods can often predict high change scores for words which are not undergoing any real diachronic semantic shift in the lexicographic sense of the term (or at least the status of these shifts is questionable). Such challenging cases are discussed in detail with examples, and their linguistic categorization is proposed. Our conclusion is that pre-trained contextualized language models are prone to confound changes in lexicographic senses and changes in contextual variance, which naturally stem from their distributional nature, but is different from the types of issues observed in methods based on static embeddings. Additionally, they often merge together syntactic and semantic aspects of lexical entities. We propose a range of possible future solutions to these issues."
16,acl,2021,Erase and Rewind: Manual Correction of NLP Output through a Web Interface,https://doi.org/10.18653/v1/2021.acl-demo.13,"The character information in natural scene images contains various personal information, such as telephone numbers, home addresses, etc. It is a high risk of leakage the information if they are published. In this paper, we proposed a scene text erasing method to properly hide the information via an inpainting convolutional neural network (CNN) model. The input is a scene text image, and the output is expected to be text erased image with all the character regions filled up the colors of the surrounding background pixels. This work is accomplished by a CNN model through convolution to deconvolution with interconnection process. The training samples and the corresponding inpainting images are considered as teaching signals for training. To evaluate the text erasing performance, the output images are detected by a novel scene text detection method. Subsequently, the same measurement on text detection is utilized for testing the images in benchmark dataset ICDAR2013. Compared with direct text detection way, the scene text erasing process demonstrates a drastically decrease on the precision, recall and f-score. That proves the effectiveness of proposed method for erasing the text in natural scene images."
17,acl,2021,fastHan: A BERT-based Multi-Task Toolkit for Chinese NLP,https://doi.org/10.18653/v1/2021.acl-demo.12,"We introduce \texttt{N-LTP}, an open-source neural language technology platform supporting six fundamental Chinese NLP tasks: {lexical analysis} (Chinese word segmentation, part-of-speech tagging, and named entity recognition), {syntactic parsing} (dependency parsing), and {semantic parsing} (semantic dependency parsing and semantic role labeling). Unlike the existing state-of-the-art toolkits, such as \texttt{Stanza}, that adopt an independent model for each task, \texttt{N-LTP} adopts the multi-task framework by using a shared pre-trained model, which has the advantage of capturing the shared knowledge across relevant Chinese tasks. In addition, a knowledge distillation method \cite{DBLP:journals/corr/abs-1907-04829} where the single-task model teaches the multi-task model is further introduced to encourage the multi-task model to surpass its single-task teacher. Finally, we provide a collection of easy-to-use APIs and a visualization tool to make users to use and view the processing results more easily and directly. To the best of our knowledge, this is the first toolkit to support six Chinese NLP fundamental tasks. Source code, documentation, and pre-trained models are available at \url{https://github.com/HIT-SCIR/ltp}."
18,acl,2021,"IFlyEA: A Chinese Essay Assessment System with Automated Rating, Review Generation, and Recommendation",https://doi.org/10.18653/v1/2021.acl-demo.29,The first automated essay scoring system was developed 50 years ago. Automated essay scoring systems are developing into systems with richer functions than the previous simple scoring systems. Its purpose is not only to score essays but also as a learning tool to improve the writing skill of users. Feedback is the most important aspect of making an automated essay scoring system useful in real life. The importance of feedback was already emphasized in the first AES system. This paper reviews research on feedback including different feedback types and essay traits on automated essay scoring. We also reviewed the latest case studies of the automated essay scoring system that provides feedback.
19,acl,2021,"Many-to-English Machine Translation Tools, Data, and Pretrained Models",https://doi.org/10.18653/v1/2021.acl-demo.37,"Reproducible benchmarks are crucial in driving progress of machine translation research. However, existing machine translation benchmarks have been mostly limited to high-resource or well-represented languages. Despite an increasing interest in low-resource machine translation, there are no standardized reproducible benchmarks for many African languages, many of which are used by millions of speakers but have less digitized textual data. To tackle these challenges, we propose AfroMT, a standardized, clean, and reproducible machine translation benchmark for eight widely spoken African languages. We also develop a suite of analysis tools for system diagnosis taking into account the unique properties of these languages. Furthermore, we explore the newly considered case of low-resource focused pretraining and develop two novel data augmentation-based strategies, leveraging word-level alignment information and pseudo-monolingual data for pretraining multilingual sequence-to-sequence models. We demonstrate significant improvements when pretraining on 11 languages, with gains of up to 2 BLEU points over strong baselines. We also show gains of up to 12 BLEU points over cross-lingual transfer baselines in data-constrained scenarios. All code and pretrained models will be released as further steps towards larger reproducible benchmarks for African languages."
20,acl,2021,Video-guided Machine Translation with Spatial Hierarchical Attention Network,https://doi.org/10.18653/v1/2021.acl-srw.9,"Neural Machine Translation (NMT) can be improved by including document-level contextual information. For this purpose, we propose a hierarchical attention model to capture the context in a structured and dynamic manner. The model is integrated in the original NMT architecture as another level of abstraction, conditioning on the NMT model's own previous hidden states. Experiments show that hierarchical attention significantly improves the BLEU score over a strong NMT baseline with the state-of-the-art in context-aware methods, and that both the encoder and decoder benefit from context in complementary ways."
21,acl,2021,SumPubMed: Summarization Dataset of PubMed Scientific Articles,https://doi.org/10.18653/v1/2021.acl-srw.30,"We propose an unsupervised graph-based ranking model for extractive summarization of long scientific documents. Our method assumes a two-level hierarchical graph representation of the source document, and exploits asymmetrical positional cues to determine sentence importance. Results on the PubMed and arXiv datasets show that our approach outperforms strong unsupervised baselines by wide margins in automatic metrics and human evaluation. In addition, it achieves performance comparable to many state-of-the-art supervised approaches which are trained on hundreds of thousands of examples. These results suggest that patterns in the discourse structure are a strong signal for determining importance in scientific articles."
