Index,Label,Year,Title,EE,summary
63,acl,2021,On the Relationship between Zipf&apos;s Law of Abbreviation and Interfering Noise in Emergent Languages,https://doi.org/10.18653/v1/2021.acl-srw.6,"The pioneering research of G. K. Zipf on the relationship between word frequency and other word features led to the formulation of various linguistic laws. The most popular is Zipf's law for word frequencies. Here we focus on two laws that have been studied less intensively: the meaning-frequency law, i.e. the tendency of more frequent words to be more polysemous, and the law of abbreviation, i.e. the tendency of more frequent words to be shorter. In a previous work, we tested the robustness of these Zipfian laws for English, roughly measuring word length in number of characters and distinguishing adult from child speech. In the present article, we extend our study to other languages (Dutch and Spanish) and introduce two additional measures of length: syllabic length and phonemic length. Our correlation analysis indicates that both the meaning-frequency law and the law of abbreviation hold overall in all the analyzed languages."
64,acl,2021,On the differences between BERT and MT encoder spaces and how to address them in translation tasks,https://doi.org/10.18653/v1/2021.acl-srw.35,"BERT-enhanced neural machine translation (NMT) aims at leveraging BERT-encoded representations for translation tasks. A recently proposed approach uses attention mechanisms to fuse Transformer's encoder and decoder layers with BERT's last-layer representation and shows enhanced performance. However, their method doesn't allow for the flexible distribution of attention between the BERT representation and the encoder/decoder representation. In this work, we propose a novel BERT-enhanced NMT model called BERT-JAM which improves upon existing models from two aspects: 1) BERT-JAM uses joint-attention modules to allow the encoder/decoder layers to dynamically allocate attention between different representations, and 2) BERT-JAM allows the encoder/decoder layers to make use of BERT's intermediate representations by composing them using a gated linear unit (GLU). We train BERT-JAM with a novel three-phase optimization strategy that progressively unfreezes different components of BERT-JAM. Our experiments show that BERT-JAM achieves SOTA BLEU scores on multiple translation tasks."
65,acl,2021,"SummVis: Interactive Visual Analysis of Models, Data, and Evaluation for Text Summarization",https://doi.org/10.18653/v1/2021.acl-demo.18,"Novel neural architectures, training strategies, and the availability of large-scale corpora haven been the driving force behind recent progress in abstractive text summarization. However, due to the black-box nature of neural models, uninformative evaluation metrics, and scarce tooling for model and data analysis, the true performance and failure modes of summarization models remain largely unknown. To address this limitation, we introduce SummVis, an open-source tool for visualizing abstractive summaries that enables fine-grained analysis of the models, data, and evaluation metrics associated with text summarization. Through its lexical and semantic visualizations, the tools offers an easy entry point for in-depth model prediction exploration across important dimensions such as factual consistency or abstractiveness. The tool together with several pre-computed model outputs is available at https://github.com/robustness-gym/summvis."
66,acl,2021,TextFlint: Unified Multilingual Robustness Evaluation Toolkit for Natural Language Processing,https://doi.org/10.18653/v1/2021.acl-demo.41,"Various robustness evaluation methodologies from different perspectives have been proposed for different natural language processing (NLP) tasks. These methods have often focused on either universal or task-specific generalization capabilities. In this work, we propose a multilingual robustness evaluation platform for NLP tasks (TextFlint) that incorporates universal text transformation, task-specific transformation, adversarial attack, subpopulation, and their combinations to provide comprehensive robustness analysis. TextFlint enables practitioners to automatically evaluate their models from all aspects or to customize their evaluations as desired with just a few lines of code. To guarantee user acceptability, all the text transformations are linguistically based, and we provide a human evaluation for each one. TextFlint generates complete analytical reports as well as targeted augmented data to address the shortcomings of the model's robustness. To validate TextFlint's utility, we performed large-scale empirical evaluations (over 67,000 evaluations) on state-of-the-art deep learning models, classic supervised methods, and real-world systems. Almost all models showed significant performance degradation, including a decline of more than 50% of BERT's prediction accuracy on tasks such as aspect-level sentiment classification, named entity recognition, and natural language inference. Therefore, we call for the robustness to be included in the model evaluation, so as to promote the healthy development of NLP technology."
67,acl,2021,Dodrio: Exploring Transformer Models with Interactive Visualization,https://doi.org/10.18653/v1/2021.acl-demo.16,"Modeling semantic information is helpful for scene text recognition. In this work, we propose to model semantic and visual information jointly with a Visual-Semantic Transformer (VST). The VST first explicitly extracts primary semantic information from visual feature maps with a transformer module and a primary visual-semantic alignment module. The semantic information is then joined with the visual feature maps (viewed as a sequence) to form a pseudo multi-domain sequence combining visual and semantic information, which is subsequently fed into an transformer-based interaction module to enable learning of interactions between visual and semantic features. In this way, the visual features can be enhanced by the semantic information and vice versus. The enhanced version of visual features are further decoded by a secondary visual-semantic alignment module which shares weights with the primary one. Finally, the decoded visual features and the enhanced semantic features are jointly processed by the third transformer module obtaining the final text prediction. Experiments on seven public benchmarks including regular/ irregular text recognition datasets verifies the effectiveness our proposed model, reaching state of the art on four of the seven benchmarks."
68,acl,2021,Transformer-Based Direct Hidden Markov Model for Machine Translation,https://doi.org/10.18653/v1/2021.acl-srw.3,"Simultaneous machine translation (SiMT) outputs the target sequence while receiving the source sequence, and hence learning when to start translating each target token is the core challenge for SiMT task. However, it is non-trivial to learn the optimal moment among many possible moments of starting translating, as the moments of starting translating always hide inside the model and can only be supervised with the observed target sequence. In this paper, we propose a Hidden Markov Transformer (HMT), which treats the moments of starting translating as hidden events and the target sequence as the corresponding observed events, thereby organizing them as a hidden Markov model. HMT explicitly models multiple moments of starting translating as the candidate hidden events, and then selects one to generate the target token. During training, by maximizing the marginal likelihood of the target sequence over multiple moments of starting translating, HMT learns to start translating at the moments that target tokens can be generated more accurately. Experiments on multiple SiMT benchmarks show that HMT outperforms strong baselines and achieves state-of-the-art performance."
69,acl,2021,Stage-wise Fine-tuning for Graph-to-Text Generation,https://doi.org/10.18653/v1/2021.acl-srw.2,"A semantic equivalence assessment is defined as a task that assesses semantic equivalence in a sentence pair by binary judgment (i.e., paraphrase identification) or grading (i.e., semantic textual similarity measurement). It constitutes a set of tasks crucial for research on natural language understanding. Recently, BERT realized a breakthrough in sentence representation learning (Devlin et al., 2019), which is broadly transferable to various NLP tasks. While BERT's performance improves by increasing its model size, the required computational power is an obstacle preventing practical applications from adopting the technology. Herein, we propose to inject phrasal paraphrase relations into BERT in order to generate suitable representations for semantic equivalence assessment instead of increasing the model size. Experiments on standard natural language understanding tasks confirm that our method effectively improves a smaller BERT model while maintaining the model size. The generated model exhibits superior performance compared to a larger BERT model on semantic equivalence assessment tasks. Furthermore, it achieves larger performance gains on tasks with limited training datasets for fine-tuning, which is a property desirable for transfer learning."
70,acl,2021,KuiLeiXi: a Chinese Open-Ended Text Adventure Game,https://doi.org/10.18653/v1/2021.acl-demo.21,"Interactive fictions, or text-adventures, are games in which a player interacts with a world entirely through textual descriptions and text actions. Text-adventure games are typically structured as puzzles or quests wherein the player must execute certain actions in a certain order to succeed. In this paper, we consider the problem of procedurally generating a quest, defined as a series of actions required to progress towards a goal, in a text-adventure game. Quest generation in text environments is challenging because they must be semantically coherent. We present and evaluate two quest generation techniques: (1) a Markov model, and (2) a neural generative model. We specifically look at generating quests about cooking and train our models on recipe data. We evaluate our techniques with human participant studies looking at perceived creativity and coherence."
71,acl,2021,TURING: an Accurate and Interpretable Multi-Hypothesis Cross-Domain Natural Language Database Interface,https://doi.org/10.18653/v1/2021.acl-demo.36,"A natural language database interface (NLDB) can democratize data-driven insights for non-technical users. However, existing Text-to-SQL semantic parsers cannot achieve high enough accuracy in the cross-database setting to allow good usability in practice. This work presents Turing, a NLDB system toward bridging this gap. The cross-domain semantic parser of Turing with our novel value prediction method achieves $75.1\%$ execution accuracy, and $78.3\%$ top-5 beam execution accuracy on the Spider validation set. To benefit from the higher beam accuracy, we design an interactive system where the SQL hypotheses in the beam are explained step-by-step in natural language, with their differences highlighted. The user can then compare and judge the hypotheses to select which one reflects their intention if any. The English explanations of SQL queries in Turing are produced by our high-precision natural language generation system based on synchronous grammars."
72,acl,2021,FastSeq: Make Sequence Generation Faster,https://doi.org/10.18653/v1/2021.acl-demo.26,"We have recently used genetic programming to automatically generate an improved version of Langmead's DNA read alignment tool Bowtie2 Sect.5.3 RN/12/09. We find it runs more than four times faster than the Bioinformatics sequencing tool (BWA) currently used with short next generation paired end DNA sequences by the Cancer Institute, takes less memory and yet finds similar matches in the human genome."
73,acl,2021,Predicting pragmatic discourse features in the language of adults with autism spectrum disorder,https://doi.org/10.18653/v1/2021.acl-srw.29,"Diagnostic procedures for ASD (autism spectrum disorder) involve semi-naturalistic interactions between the child and a clinician. Computational methods to analyze these sessions require an end-to-end speech and language processing pipeline that go from raw audio to clinically-meaningful behavioral features. An important component of this pipeline is the ability to automatically detect who is speaking when i.e., perform child-adult speaker classification. This binary classification task is often confounded due to variability associated with the participants' speech and background conditions. Further, scarcity of training data often restricts direct application of conventional deep learning methods. In this work, we address two major sources of variability - age of the child and data source collection location - using domain adversarial learning which does not require labeled target domain data. We use two methods, generative adversarial training with inverted label loss and gradient reversal layer to learn speaker embeddings invariant to the above sources of variability, and analyze different conditions under which the proposed techniques improve over conventional learning methods. Using a large corpus of ADOS-2 (autism diagnostic observation schedule, 2nd edition) sessions, we demonstrate upto 13.45% and 6.44% relative improvements over conventional learning methods."
74,acl,2021,OpenAttack: An Open-source Textual Adversarial Attack Toolkit,https://doi.org/10.18653/v1/2021.acl-demo.43,"Textual adversarial attacking has received wide and increasing attention in recent years. Various attack models have been proposed, which are enormously distinct and implemented with different programming frameworks and settings. These facts hinder quick utilization and fair comparison of attack models. In this paper, we present an open-source textual adversarial attack toolkit named OpenAttack to solve these issues. Compared with existing other textual adversarial attack toolkits, OpenAttack has its unique strengths in support for all attack types, multilinguality, and parallel processing. Currently, OpenAttack includes 15 typical attack models that cover all attack types. Its highly inclusive modular design not only supports quick utilization of existing attack models, but also enables great flexibility and extensibility. OpenAttack has broad uses including comparing and evaluating attack models, measuring robustness of a model, assisting in developing new attack models, and adversarial training. Source code and documentation can be obtained at https://github.com/thunlp/OpenAttack."
75,acl,2021,ChrEnTranslate: Cherokee-English Machine Translation Demo with Quality Estimation and Corrective Feedback,https://doi.org/10.18653/v1/2021.acl-demo.33,"We introduce ChrEnTranslate, an online machine translation demonstration system for translation between English and an endangered language Cherokee. It supports both statistical and neural translation models as well as provides quality estimation to inform users of reliability, two user feedback interfaces for experts and common users respectively, example inputs to collect human translations for monolingual data, word alignment visualization, and relevant terms from the Cherokee-English dictionary. The quantitative evaluation demonstrates that our backbone translation models achieve state-of-the-art translation performance and our quality estimation well correlates with both BLEU and human judgment. By analyzing 216 pieces of expert feedback, we find that NMT is preferable because it copies less than SMT, and, in general, current models can translate fragments of the source sentence but make major mistakes. When we add these 216 expert-corrected parallel texts back into the training set and retrain models, equal or slightly better performance is observed, which indicates the potential of human-in-the-loop learning. Our online demo is at https://chren.cs.unc.edu/ , our code is open-sourced at https://github.com/ZhangShiyue/ChrEnTranslate , and our data is available at https://github.com/ZhangShiyue/ChrEn"
76,acl,2021,TEXTOIR: An Integrated and Visualized Platform for Text Open Intent Recognition,https://doi.org/10.18653/v1/2021.acl-demo.20,"TEXTOIR is the first integrated and visualized platform for text open intent recognition. It is composed of two main modules: open intent detection and open intent discovery. Each module integrates most of the state-of-the-art algorithms and benchmark intent datasets. It also contains an overall framework connecting the two modules in a pipeline scheme. In addition, this platform has visualized tools for data and model management, training, evaluation and analysis of the performance from different aspects. TEXTOIR provides useful toolkits and convenient visualized interfaces for each sub-module (Toolkit code: https://github.com/thuiar/TEXTOIR), and designs a framework to implement a complete process to both identify known intents and discover open intents (Demo code: https://github.com/thuiar/TEXTOIR-DEMO)."
77,acl,2021,NeurST: Neural Speech Translation Toolkit,https://doi.org/10.18653/v1/2021.acl-demo.7,"NeurST is an open-source toolkit for neural speech translation. The toolkit mainly focuses on end-to-end speech translation, which is easy to use, modify, and extend to advanced speech translation research and products. NeurST aims at facilitating the speech translation research for NLP researchers and building reliable benchmarks for this field. It provides step-by-step recipes for feature extraction, data preprocessing, distributed training, and evaluation. In this paper, we will introduce the framework design of NeurST and show experimental results for different benchmark datasets, which can be regarded as reliable baselines for future research. The toolkit is publicly available at https://github.com/bytedance/neurst/ and we will continuously update the performance of NeurST with other counterparts and studies at https://st-benchmark.github.io/."
78,acl,2021,CRSLab: An Open-Source Toolkit for Building Conversational Recommender System,https://doi.org/10.18653/v1/2021.acl-demo.22,"We present an extensible user simulation toolkit to facilitate automatic evaluation of conversational recommender systems. It builds on an established agenda-based approach and extends it with several novel elements, including user satisfaction prediction, persona and context modeling, and conditional natural language generation. We showcase the toolkit with a pre-existing movie recommender system and demonstrate its ability to simulate dialogues that mimic real conversations, while requiring only a handful of manually annotated dialogues as training data."
79,acl,2021,AutoRC: Improving BERT Based Relation Classification Models via Architecture Search,https://doi.org/10.18653/v1/2021.acl-srw.4,"Although BERT based relation classification (RC) models have achieved significant improvements over the traditional deep learning models, it seems that no consensus can be reached on what is the optimal architecture. Firstly, there are multiple alternatives for entity span identification. Second, there are a collection of pooling operations to aggregate the representations of entities and contexts into fixed length vectors. Third, it is difficult to manually decide which feature vectors, including their interactions, are beneficial for classifying the relation types. In this work, we design a comprehensive search space for BERT based RC models and employ neural architecture search (NAS) method to automatically discover the design choices mentioned above. Experiments on seven benchmark RC tasks show that our method is efficient and effective in finding better architectures than the baseline BERT based RC model. Ablation study demonstrates the necessity of our search space design and the effectiveness of our search method."
80,acl,2021,MVP-BERT: Multi-Vocab Pre-training for Chinese BERT,https://doi.org/10.18653/v1/2021.acl-srw.27,"Grapheme-to-phoneme (G2P) conversion is an indispensable part of the Chinese Mandarin text-to-speech (TTS) system, and the core of G2P conversion is to solve the problem of polyphone disambiguation, which is to pick up the correct pronunciation for several candidates for a Chinese polyphonic character. In this paper, we propose a Chinese polyphone BERT model to predict the pronunciations of Chinese polyphonic characters. Firstly, we create 741 new Chinese monophonic characters from 354 source Chinese polyphonic characters by pronunciation. Then we get a Chinese polyphone BERT by extending a pre-trained Chinese BERT with 741 new Chinese monophonic characters and adding a corresponding embedding layer for new tokens, which is initialized by the embeddings of source Chinese polyphonic characters. In this way, we can turn the polyphone disambiguation task into a pre-training task of the Chinese polyphone BERT. Experimental results demonstrate the effectiveness of the proposed model, and the polyphone BERT model obtain 2% (from 92.1% to 94.1%) improvement of average accuracy compared with the BERT-based classifier model, which is the prior state-of-the-art in polyphone disambiguation."
81,acl,2021,"Proceedings of the ACL-IJCNLP 2021 Student Research Workshop, ACL 2021, Online, JUli 5-10, 2021",https://aclanthology.org/volumes/2021.acl-srw/,"This volume contains the post-proceedings of the Sixteenth Logical and Semantic Frameworks with Applications (LSFA 2021). The meeting was held online on July 23-24, 2021, organised by the Universidad de Buenos Aires, Argentina. LSFA aims to bring researchers and students interested in theoretical and practical aspects of logical and semantic frameworks and their applications. The covered topics include proof theory, type theory and rewriting theory, specification and deduction languages, and formal semantics of languages and systems."
82,acl,2021,"Proceedings of the Joint Conference of the 59th Annual Meeting of the Association for Computational Linguistics and the 11th International Joint Conference on Natural Language Processing, ACL 2021 - System Demonstrations, Online, August 1-6, 2021",https://aclanthology.org/volumes/2021.acl-demo/,"Countermeasures to effectively fight the ever increasing hate speech online without blocking freedom of speech is of great social interest. Natural Language Generation (NLG), is uniquely capable of developing scalable solutions. However, off-the-shelf NLG methods are primarily sequence-to-sequence neural models and they are limited in that they generate commonplace, repetitive and safe responses regardless of the hate speech (e.g., ""Please refrain from using such language."") or irrelevant responses, making them ineffective for de-escalating hateful conversations. In this paper, we design a three-module pipeline approach to effectively improve the diversity and relevance. Our proposed pipeline first generates various counterspeech candidates by a generative model to promote diversity, then filters the ungrammatical ones using a BERT model, and finally selects the most relevant counterspeech response using a novel retrieval-based method. Extensive Experiments on three representative datasets demonstrate the efficacy of our approach in generating diverse and relevant counterspeech."
